{
  "title": "Chats & chiens : deux fa√ßons d‚Äôaimer üêæ",
  "slug": "chats-chiens-deux-facons-d-aimer",
  "category": "Commerces & lieux",
  "tags": [
    "cat",
    "dog",
    "animals"
  ],
  "body": "<!-- MAGAZINE_EDITOR_STATE: {\"blocks\":[{\"id\":\"1764294105067qnox4\",\"type\":\"title\",\"content\":{\"title\":\"Chats & chiens : deux fa√ßons d‚Äôaimer üêæ\",\"subtitle\":\"we love animals\"}},{\"id\":\"1764294131158esbxf\",\"type\":\"text\",\"content\":{\"text\":\"*Il y a des d√©bats qui ne vieillissent pas : pain au chocolat ou chocolatine, mer ou montagne‚Ä¶ et bien s√ªr, chats ou chiens. Mais au fond, comparer ces deux compagnons, ce n‚Äôest pas choisir un camp. C‚Äôest plut√¥t comprendre deux langages de l‚Äôaffection, deux rythmes de vie, deux mani√®res d‚Äôhabiter le quotidien.*\\n\\nDans un monde qui va vite, vivre avec un animal, c‚Äôest souvent r√©apprendre la simplicit√© : une pr√©sence fid√®le, un regard qui ram√®ne au moment pr√©sent, un rituel qui structure la journ√©e. Chats et chiens peuvent offrir cela, mais chacun √† sa mani√®re.\",\"layout\":\"left_third\",\"dropCap\":true}},{\"id\":\"17642941452379phr6\",\"type\":\"text\",\"content\":{\"text\":\"**Le chien est souvent l‚Äôanimal du ‚Äúnous‚Äù. Il s‚Äôattache, suit, attend, participe. Il aime l‚Äôid√©e de faire partie d‚Äôune √©quipe : la v√¥tre. Il y a une franchise presque rassurante dans sa fa√ßon d‚Äô√™tre heureux : une promenade, une voix famili√®re, une main pos√©e sur sa t√™te, et le monde devient plus doux.**\\n\\nLe chat, lui, est souvent l‚Äôanimal du ‚Äúje‚Äù. Il choisit, il observe, il s‚Äôapproche quand il le d√©cide. Son affection n‚Äôest pas moins r√©elle, elle est juste plus subtile. Un chat qui vient se coller contre vous ne le fait pas par obligation : c‚Äôest une confiance offerte, un privil√®ge discret. Avec lui, on apprend vite que l‚Äôamour n‚Äôa pas toujours besoin de bruit.\",\"layout\":\"left_third\",\"heading\":\"Deux temp√©raments, deux univers\",\"dropCap\":true}},{\"id\":\"1764294167900x1pfz\",\"type\":\"text\",\"content\":{\"text\":\"Avec un chien, la journ√©e s‚Äôorganise. Il y a des horaires, des habitudes, des sorties. Pour certains, c‚Äôest une contrainte. Pour d‚Äôautres, c‚Äôest une b√©n√©diction : une routine saine, une raison de sortir m√™me quand on n‚Äôen a pas envie, une structure dans le chaos. Le chien vous oblige √† √™tre l√†, et parfois c‚Äôest exactement ce dont on a besoin.\\n\\n- I\\n- LOVE\\n- CATS\\n\\nLe chat s‚Äôadapte plus facilement √† une vie irr√©guli√®re. Il peut rester seul plusieurs heures sans drame, √† condition d‚Äôavoir de quoi manger, boire, jouer, et un environnement enrichi. Cela ne veut pas dire qu‚Äôil ne souffre jamais de la solitude, mais son autonomie fait qu‚Äôil se fond souvent plus ~~facilement dans un quotidien urbain ou charg√©.~~\",\"layout\":\"left_third\",\"heading\":\"La relation au temps : pr√©sence constante ou ind√©pendance √©l√©gante\",\"dropCap\":true}},{\"id\":\"1764294190277wklf9\",\"type\":\"text\",\"content\":{\"text\":\"Les chiens, selon leur taille et leur race, demandent souvent plus d‚Äôespace mental que d‚Äôespace r√©el. M√™me un petit chien a besoin d‚Äôattention, de stimulation, de sorties r√©guli√®res. Un chien s‚Äôennuie vite s‚Äôil n‚Äôa rien √† faire : il a besoin d‚Äôinteractions, de jeux, d‚Äôodeurs √† explorer, d‚Äôun monde √† d√©couvrir[^1].\\n\\nLes chats, eux, vivent beaucoup dans la verticalit√© : un appartement peut leur convenir tr√®s bien si on pense ‚Äúhauteur‚Äù et ‚Äúterritoire‚Äù. Un arbre √† chat bien plac√©, quelques cachettes, une fen√™tre o√π observer le monde, et leur univers devient riche. Le chat ne demande pas forc√©ment moins de soin qu‚Äôun chien, mais son √©nergie se g√®re diff√©remment : il alterne souvent phases de jeu intense et longues siestes, comme un artiste qui travaille par √©clairs.\",\"layout\":\"left_third\",\"heading\":\"Espace, √©nergie, et mode de vie\"}},{\"id\":\"1764294217546pidfc\",\"type\":\"text\",\"content\":{\"text\":\"Le chien est expressif. Il montre. Il r√©clame. Il pardonne vite. Son amour est souvent direct, presque √©vident. Il y a quelque chose de tr√®s humain dans cette fid√©lit√© : on se sent important, attendu, reconnu.\\n\\nLe chat est plus nuanc√©. Il parle avec le corps : une queue qui se l√®ve, un frottement contre la jambe, un regard lent, une pr√©sence pos√©e √† c√¥t√© de vous sans demander rien. Il n‚Äôest pas froid : il est s√©lectif. Certains chats sont tr√®s c√¢lins, d‚Äôautres plus r√©serv√©s, mais m√™me les plus ind√©pendants d√©veloppent souvent une forme de lien profond, plus silencieuse, plus fine[^2].\",\"layout\":\"right_third\",\"heading\":\"Le langage de l‚Äôaffection\"}},{\"id\":\"1764294235345cs1c2\",\"type\":\"text\",\"content\":{\"text\":\"Vivre avec un chien, c‚Äôest aussi vivre avec l‚Äôid√©e d‚Äô√©duquer. Apprendre la marche, la propret√©, la gestion des √©motions, la relation aux autres chiens et aux humains. Cela demande du temps, de la patience, et parfois une vraie remise en question. Mais c‚Äôest aussi ce qui rend la relation si forte : on grandit ensemble.\\n\\nAvec un chat, l‚Äô√©ducation existe aussi, mais elle ressemble moins √† des ‚Äúordres‚Äù qu‚Äô√† une n√©gociation. Le chat comprend tr√®s bien ce que vous voulez‚Ä¶ et choisit parfois de faire autrement. On apprend alors √† am√©nager plut√¥t qu‚Äô√† contr√¥ler : prot√©ger le canap√©, proposer un griffoir, rendre certains endroits accessibles et d‚Äôautres non. La cohabitation devient un art de l‚Äô√©quilibre.\",\"layout\":\"right_third\",\"heading\":\"√âducation, limites, et cohabitation\"}},{\"id\":\"1764294387052mi7t9\",\"type\":\"divider\",\"content\":{\"dividerStyle\":\"bold\",\"dividerWidth\":\"full\"}},{\"id\":\"1764294254083nfr8t\",\"type\":\"text\",\"content\":{\"text\":\"Un chien vous rappelle l‚Äôimportance de sortir, de bouger, de respirer. Il vous donne une raison de marcher, de rencontrer des voisins, de regarder le ciel m√™me quand vous √™tes fatigu√©. Il a une joie contagieuse. Avec lui, le monde est souvent un peu plus simple.\\n\\nUn chat vous apprend autre chose : ralentir. Observer. Respecter l‚Äôespace. Comprendre qu‚Äôune pr√©sence peut √™tre intense sans √™tre envahissante. Il y a une √©l√©gance dans leur fa√ßon d‚Äôhabiter le silence. Ils transforment un canap√© en refuge, une fen√™tre en cin√©ma, une soir√©e ordinaire en moment de calme pr√©cieux.\",\"layout\":\"right_third\",\"heading\":\"La tendresse au quotidien : ce que l‚Äôanimal change en nous\"}},{\"id\":\"1764294325743azq5d\",\"type\":\"quote\",\"content\":{\"quote\":\"Un chat vous apprend autre chose\",\"author\":\"Author Name\",\"layout\":\"left_third\"}},{\"id\":\"1764294270089lvfa7\",\"type\":\"text\",\"content\":{\"text\":\"Choisir entre chat et chien, ce n‚Äôest pas seulement une question de pr√©f√©rence. C‚Äôest une question de rythme, d‚Äô√©nergie, de disponibilit√©, parfois m√™me de personnalit√©. Avez-vous envie d‚Äôun compagnon qui vous emm√®ne dehors, qui vous pousse √† √™tre actif, qui vit la relation de mani√®re d√©monstrative ? Ou cherchez-vous une pr√©sence plus autonome, plus discr√®te, qui partage votre espace sans l‚Äôenvahir ?\\n\\nEt puis, il y a une v√©rit√© simple : on ne choisit pas toujours. Parfois, c‚Äôest un chien qui vous adopte. Parfois, c‚Äôest un chat qui d√©cide que votre maison est d√©sormais la sienne. Et dans les deux cas, il se passe souvent quelque chose de beau : une vie ordinaire devient plus vivante.\",\"layout\":\"right_third\",\"heading\":\"Et si la vraie question √©tait : de quoi avez-vous besoin aujourd‚Äôhui ?\"}},{\"id\":\"1764294287558ejkz0\",\"type\":\"text\",\"content\":{\"text\":\"Chats et chiens ne se ressemblent pas, et c‚Äôest justement ce qui les rend fascinants. Le chien est un compagnon de route, le chat est un compagnon d‚Äôint√©rieur. L‚Äôun √©claire la journ√©e par son enthousiasme, l‚Äôautre la calme par sa pr√©sence. L‚Äôun vous appelle, l‚Äôautre vous choisit.\\n\\nMais au final, qu‚Äôil s‚Äôagisse d‚Äôun museau humide qui vous attend √† la porte ou d‚Äôun ronronnement qui s‚Äôinstalle pr√®s de vous, c‚Äôest la m√™me promesse : celle d‚Äôun lien simple, profond, et incroyablement humain ‚Äî m√™me quand il vient d‚Äôun animal.\",\"layout\":\"two_thirds\",\"heading\":\"Conclusion : deux amours, deux styles, une m√™me chaleur\"}},{\"id\":\"1764294305114ozud6\",\"type\":\"quote\",\"content\":{\"quote\":\"Nolwenn\",\"author\":\"Author \"}},{\"id\":\"1764294348080afnqg\",\"type\":\"image\",\"content\":{\"imageUrl\":\"blob:https://a-la-brestoise.vercel.app/5e019214-5b02-4b65-94a5-7c080c7cda91\",\"layout\":\"full\",\"position\":\"center\",\"scale\":1,\"imageFileName\":\"1.jpg\",\"caption\":\"cute dog\"}},{\"id\":\"1764294354354my2rt\",\"type\":\"image\",\"content\":{\"imageUrl\":\"blob:https://a-la-brestoise.vercel.app/d04821d7-4c16-4a76-a92f-cf7a4ccf9010\",\"layout\":\"full\",\"position\":\"left\",\"scale\":1,\"imageFileName\":\"2.jpg\",\"caption\":\"marmish cat\"}},{\"id\":\"176429436109055smx\",\"type\":\"image\",\"content\":{\"imageUrl\":\"blob:https://a-la-brestoise.vercel.app/d817084e-7949-4e1e-b704-c9c7987d9b63\",\"layout\":\"full\",\"position\":\"right\",\"scale\":1,\"imageFileName\":\"3.avif\",\"caption\":\"lazy cat\"}},{\"id\":\"1764294366305vw8j3\",\"type\":\"image\",\"content\":{\"imageUrl\":\"blob:https://a-la-brestoise.vercel.app/06b4717b-f41a-4969-addb-f0603815285b\",\"layout\":\"full\",\"position\":\"right\",\"scale\":1,\"imageFileName\":\"4.jpg\",\"caption\":\"hahame every\"}},{\"id\":\"1764294375087ily0x\",\"type\":\"image\",\"content\":{\"imageUrl\":\"blob:https://a-la-brestoise.vercel.app/03cfcd2d-01cb-447a-b5d4-c2a6d276966a\",\"layout\":\"full\",\"position\":\"center\",\"scale\":1,\"imageFileName\":\"5.webp\",\"caption\":\"me every night\"}}],\"references\":[{\"id\":\"1\",\"title\":\"cat\",\"url\":\"https://en.wikipedia.org/wiki/Cat\",\"publisher\":\"wikipidia\",\"date\":\"\"},{\"id\":\"2\",\"title\":\"Dogs\",\"url\":\"https://en.wikipedia.org/wiki/Dog\",\"publisher\":\"wikipidia\",\"date\":\"\"}],\"settings\":{\"headerEnabled\":true,\"headerText\":\"√Ä la Brestoise\",\"footerEnabled\":true,\"footerText\":\"we love animals\",\"publishedAt\":\"2025-11-28\",\"readingTimeMode\":\"auto\",\"readingTimeMinutes\":5,\"featured\":true,\"date\":\"2025-11-28\",\"readingMinutes\":4,\"category\":\"Commerces & lieux\"}} -->\n\n# Chats & chiens : deux fa√ßons d‚Äôaimer üêæ\n*we love animals*\n\n\n*Il y a des d√©bats qui ne vieillissent pas : pain au chocolat ou chocolatine, mer ou montagne‚Ä¶ et bien s√ªr, chats ou chiens. Mais au fond, comparer ces deux compagnons, ce n‚Äôest pas choisir un camp. C‚Äôest plut√¥t comprendre deux langages de l‚Äôaffection, deux rythmes de vie, deux mani√®res d‚Äôhabiter le quotidien.*\n\nDans un monde qui va vite, vivre avec un animal, c‚Äôest souvent r√©apprendre la simplicit√© : une pr√©sence fid√®le, un regard qui ram√®ne au moment pr√©sent, un rituel qui structure la journ√©e. Chats et chiens peuvent offrir cela, mais chacun √† sa mani√®re.\n\n## Deux temp√©raments, deux univers\n\n**Le chien est souvent l‚Äôanimal du ‚Äúnous‚Äù. Il s‚Äôattache, suit, attend, participe. Il aime l‚Äôid√©e de faire partie d‚Äôune √©quipe : la v√¥tre. Il y a une franchise presque rassurante dans sa fa√ßon d‚Äô√™tre heureux : une promenade, une voix famili√®re, une main pos√©e sur sa t√™te, et le monde devient plus doux.**\n\nLe chat, lui, est souvent l‚Äôanimal du ‚Äúje‚Äù. Il choisit, il observe, il s‚Äôapproche quand il le d√©cide. Son affection n‚Äôest pas moins r√©elle, elle est juste plus subtile. Un chat qui vient se coller contre vous ne le fait pas par obligation : c‚Äôest une confiance offerte, un privil√®ge discret. Avec lui, on apprend vite que l‚Äôamour n‚Äôa pas toujours besoin de bruit.\n\n## La relation au temps : pr√©sence constante ou ind√©pendance √©l√©gante\n\nAvec un chien, la journ√©e s‚Äôorganise. Il y a des horaires, des habitudes, des sorties. Pour certains, c‚Äôest une contrainte. Pour d‚Äôautres, c‚Äôest une b√©n√©diction : une routine saine, une raison de sortir m√™me quand on n‚Äôen a pas envie, une structure dans le chaos. Le chien vous oblige √† √™tre l√†, et parfois c‚Äôest exactement ce dont on a besoin.\n\n- I\n- LOVE\n- CATS\n\nLe chat s‚Äôadapte plus facilement √† une vie irr√©guli√®re. Il peut rester seul plusieurs heures sans drame, √† condition d‚Äôavoir de quoi manger, boire, jouer, et un environnement enrichi. Cela ne veut pas dire qu‚Äôil ne souffre jamais de la solitude, mais son autonomie fait qu‚Äôil se fond souvent plus ~~facilement dans un quotidien urbain ou charg√©.~~\n\n## Espace, √©nergie, et mode de vie\n\nLes chiens, selon leur taille et leur race, demandent souvent plus d‚Äôespace mental que d‚Äôespace r√©el. M√™me un petit chien a besoin d‚Äôattention, de stimulation, de sorties r√©guli√®res. Un chien s‚Äôennuie vite s‚Äôil n‚Äôa rien √† faire : il a besoin d‚Äôinteractions, de jeux, d‚Äôodeurs √† explorer, d‚Äôun monde √† d√©couvrir[^1].\n\nLes chats, eux, vivent beaucoup dans la verticalit√© : un appartement peut leur convenir tr√®s bien si on pense ‚Äúhauteur‚Äù et ‚Äúterritoire‚Äù. Un arbre √† chat bien plac√©, quelques cachettes, une fen√™tre o√π observer le monde, et leur univers devient riche. Le chat ne demande pas forc√©ment moins de soin qu‚Äôun chien, mais son √©nergie se g√®re diff√©remment : il alterne souvent phases de jeu intense et longues siestes, comme un artiste qui travaille par √©clairs.\n\n## Le langage de l‚Äôaffection\n\nLe chien est expressif. Il montre. Il r√©clame. Il pardonne vite. Son amour est souvent direct, presque √©vident. Il y a quelque chose de tr√®s humain dans cette fid√©lit√© : on se sent important, attendu, reconnu.\n\nLe chat est plus nuanc√©. Il parle avec le corps : une queue qui se l√®ve, un frottement contre la jambe, un regard lent, une pr√©sence pos√©e √† c√¥t√© de vous sans demander rien. Il n‚Äôest pas froid : il est s√©lectif. Certains chats sont tr√®s c√¢lins, d‚Äôautres plus r√©serv√©s, mais m√™me les plus ind√©pendants d√©veloppent souvent une forme de lien profond, plus silencieuse, plus fine[^2].\n\n## √âducation, limites, et cohabitation\n\nVivre avec un chien, c‚Äôest aussi vivre avec l‚Äôid√©e d‚Äô√©duquer. Apprendre la marche, la propret√©, la gestion des √©motions, la relation aux autres chiens et aux humains. Cela demande du temps, de la patience, et parfois une vraie remise en question. Mais c‚Äôest aussi ce qui rend la relation si forte : on grandit ensemble.\n\nAvec un chat, l‚Äô√©ducation existe aussi, mais elle ressemble moins √† des ‚Äúordres‚Äù qu‚Äô√† une n√©gociation. Le chat comprend tr√®s bien ce que vous voulez‚Ä¶ et choisit parfois de faire autrement. On apprend alors √† am√©nager plut√¥t qu‚Äô√† contr√¥ler : prot√©ger le canap√©, proposer un griffoir, rendre certains endroits accessibles et d‚Äôautres non. La cohabitation devient un art de l‚Äô√©quilibre.\n\n---\n\n## La tendresse au quotidien : ce que l‚Äôanimal change en nous\n\nUn chien vous rappelle l‚Äôimportance de sortir, de bouger, de respirer. Il vous donne une raison de marcher, de rencontrer des voisins, de regarder le ciel m√™me quand vous √™tes fatigu√©. Il a une joie contagieuse. Avec lui, le monde est souvent un peu plus simple.\n\nUn chat vous apprend autre chose : ralentir. Observer. Respecter l‚Äôespace. Comprendre qu‚Äôune pr√©sence peut √™tre intense sans √™tre envahissante. Il y a une √©l√©gance dans leur fa√ßon d‚Äôhabiter le silence. Ils transforment un canap√© en refuge, une fen√™tre en cin√©ma, une soir√©e ordinaire en moment de calme pr√©cieux.\n\n> \"Un chat vous apprend autre chose\"\n>\n> ‚Äî Author Name\n\n## Et si la vraie question √©tait : de quoi avez-vous besoin aujourd‚Äôhui ?\n\nChoisir entre chat et chien, ce n‚Äôest pas seulement une question de pr√©f√©rence. C‚Äôest une question de rythme, d‚Äô√©nergie, de disponibilit√©, parfois m√™me de personnalit√©. Avez-vous envie d‚Äôun compagnon qui vous emm√®ne dehors, qui vous pousse √† √™tre actif, qui vit la relation de mani√®re d√©monstrative ? Ou cherchez-vous une pr√©sence plus autonome, plus discr√®te, qui partage votre espace sans l‚Äôenvahir ?\n\nEt puis, il y a une v√©rit√© simple : on ne choisit pas toujours. Parfois, c‚Äôest un chien qui vous adopte. Parfois, c‚Äôest un chat qui d√©cide que votre maison est d√©sormais la sienne. Et dans les deux cas, il se passe souvent quelque chose de beau : une vie ordinaire devient plus vivante.\n\n## Conclusion : deux amours, deux styles, une m√™me chaleur\n\nChats et chiens ne se ressemblent pas, et c‚Äôest justement ce qui les rend fascinants. Le chien est un compagnon de route, le chat est un compagnon d‚Äôint√©rieur. L‚Äôun √©claire la journ√©e par son enthousiasme, l‚Äôautre la calme par sa pr√©sence. L‚Äôun vous appelle, l‚Äôautre vous choisit.\n\nMais au final, qu‚Äôil s‚Äôagisse d‚Äôun museau humide qui vous attend √† la porte ou d‚Äôun ronronnement qui s‚Äôinstalle pr√®s de vous, c‚Äôest la m√™me promesse : celle d‚Äôun lien simple, profond, et incroyablement humain ‚Äî m√™me quand il vient d‚Äôun animal.\n\n> \"Nolwenn\"\n>\n> ‚Äî Author \n\n![cute dog](blob:https://a-la-brestoise.vercel.app/5e019214-5b02-4b65-94a5-7c080c7cda91)\n*cute dog*\n\n![marmish cat](blob:https://a-la-brestoise.vercel.app/d04821d7-4c16-4a76-a92f-cf7a4ccf9010)\n*marmish cat*\n\n![lazy cat](blob:https://a-la-brestoise.vercel.app/d817084e-7949-4e1e-b704-c9c7987d9b63)\n*lazy cat*\n\n![hahame every](blob:https://a-la-brestoise.vercel.app/06b4717b-f41a-4969-addb-f0603815285b)\n*hahame every*\n\n![me every night](blob:https://a-la-brestoise.vercel.app/03cfcd2d-01cb-447a-b5d4-c2a6d276966a)\n*me every night*",
  "author": "√Ä la Brestoise",
  "date": "2025-11-28",
  "readingMinutes": 4,
  "featured": true,
  "excerpt": "we love animals",
  "sources": [
    "cat ‚Äî wikipidia",
    "Dogs ‚Äî wikipidia"
  ]
}