{
  "title": "La vague du Pilates Reformer ",
  "slug": "la-vague-du-pilates-reformer",
  "category": "Commerces & lieux",
  "tags": [
    "pilates reformer brest bretagne"
  ],
  "body": "<!-- MAGAZINE_EDITOR_STATE: {\"blocks\":[{\"id\":\"1764350787440g6vzq\",\"type\":\"title\",\"content\":{\"title\":\"La vague du Pilates Reformer \",\"subtitle\":\"Brest se met à la page !\"}},{\"id\":\"1764350397323pf72u\",\"type\":\"text\",\"content\":{\"text\":\"Loin de l'agitation des quais et du vent du large, une nouvelle élégance du mouvement s'est installée à Brest. Il ne s'agit pas d'une mode passagère, mais de l'avènement d'une discipline héritée de Joseph Pilates : la \\\"Contrology\\\". Une méthode qui, au-delà de la force, cherche l'union parfaite du corps et de l'esprit par la maîtrise du geste.\\nEt en cette fin d'année 2025, cette quête de la précision prend une dimension inédite. Le Reformer, cette machine sophistiquée de bois et d'acier qui utilise ressorts et résistance, est la nouvelle star du bien-être Brestois. Son arrivée massive, symbolisée par l'ouverture de plusieurs adresses en quelques semaines, prouve que notre ville s'aligne désormais sur les tendances mondiales pour offrir un espace exigeant au mieux-être.\\n\",\"layout\":\"full\",\"heading\":\"Cette méthode s'invite à Brest\",\"dropCap\":false}},{\"id\":\"1764350521169p3c5n\",\"type\":\"text\",\"content\":{\"text\":\"Dès le 21 novembre, The New Me s’est imposé au 34 rue Monge comme l’adresse qui ancre définitivement le Reformer dans l’air du temps. Déjà présent dans plusieurs villes, le studio débarque ici avec un concept abouti et parfaitement maîtrisé.\\nCe n’est pas seulement un espace d’entraînement : c’est un lieu de vie inspirant, pensé pour une sérénité active. Le bleu marine, clin d’œil élégant à la ville maritime ( Et oui, The New Me : c’est à chaque ville sa couleur ) se mêle à une ambiance de café healthy, créant un univers esthétique, moderne et Instagram-friendly.\\n\\nLe bar à latté est l’un des piliers du concept. Accessible à tous, que vous veniez pour un cours ou simplement pour le plaisir, il propose pour 5 € chacun des lattés dont l’incontournables matcha signature, accompagnés de snacks gluten-free signés @CopainsParis. Le spot rêvé pour les Clean Girls, les Matcha Lovers et toutes celles qui aiment prolonger une routine bien-être avec style.\\nLe shop, lui aussi pensé comme une extension naturelle du studio, met en avant des marques françaises tendances et engagées, renforçant ce positionnement lifestyle où sport, esthétique et conscience se rejoignent.\\nCôté pratique, l’expérience Reformer est millimétrée : 14 places maximum par cours, pour un encadrement précis et une progression de qualité. La fluidité est au centre des usages, avec une application dédiée qui simplifie paiements et réservations pour une expérience sans friction.\\nEt parce que The New Me soigne chaque détail, l’expérience se poursuit jusque dans les vestiaires. Douches élégantes, cosmétiques à disposition, petite routine skincare possible avant de repartir : on ressort du studio comme d’un cocon, réénergisée, impeccable et prête à reprendre sa journée. Tout est pensé, tout est beau, tout est dans la tendance bref, un lieu qui coche toutes les cases du bien-être moderne.\",\"layout\":\"two_thirds\",\"heading\":\"The New Me : La Révolution Lifestyle\"}},{\"id\":\"1764350596278flagj\",\"type\":\"text\",\"content\":{\"text\":\"Le Pura Vida Club, qui ouvrira ses portes le 8 décembre 2025, apporte à la rue Keravel une vision du bien-être rare, presque contemplative. Ici, le Reformer ne se vit pas comme une simple discipline sportive, mais comme une pièce d’un écosystème complet dédié à la régénération du corps et de l’esprit. Dès l'entrée, le murmure d'une cascade, la lumière enveloppante et une ambiance slow living installent immédiatement un sentiment de calme profond.\\nL’expérience repose sur une philosophie claire : créer un lieu où l’énergie du mouvement rencontre la douceur du ressourcement. Le studio abrite un espace bien-être complet comprenant un sauna infrarouge, un bain cryo, et des fauteuils massants pour accompagner le travail musculaire par un véritable rééquilibrage intérieur : Chaleur et froid, revitalisation et apaisement, performance et introspection : la dualité se vit ici comme un rituel qui harmonise le corps et l’esprit.\\nLa décoration, zen et enveloppante, invite presque à la méditation. Chaque détail est pensé pour que la transition entre l’effort et la détente soit naturelle, fluide. On ne vient pas seulement pour un cours : on vient pour une pause totale, un moment où tout se recentre.\\nPour s’adapter aux différents rythmes de vie, le Pura Vida Club propose quatre abonnements, à partir de 95 € par mois. Le plus complet donne accès à l’ensemble des espaces bien-être, offrant une expérience holistique du Reformer jusqu’à la récupération.\\n En effet, le Pura Vida Club se distingue par son ampleur : un véritable espace pluridisciplinaire où le Reformer n’est qu’une facette d’un ensemble plus vaste, mêlant différentes pratiques sportives et rituels de bien-être, ce qui en fait un lieu original et profondément complet.\\n\\nEt pour accompagner l’ouverture, le studio propose une offre exclusive. Du 1er au 6 décembre, il est possible de prendre rendez-vous pour visiter les lieux, découvrir le concept en avant-première et finaliser son inscription. Pour tout engagement annuel, le Pura Vida Club offre un mois gratuit, une manière élégante de franchir le seuil du club et d’entrer pleinement dans sa philosophie.\\nIci, le sport n’est pas qu’un entraînement. C’est un retour à soi, un espace où l’on se ressource entièrement  et c’est précisément ce qui fait du Pura Vida Club une adresse à part.\",\"layout\":\"two_thirds\",\"heading\":\"Pura Vida Club : L'Holistique en Profondeur\"}},{\"id\":\"1764350650566ia1dj\",\"type\":\"text\",\"content\":{\"text\":\"L’emblématique Physic Form ne reste pas en marge. Cette institution du fitness brestois annonce l'intégration prochaine d'une salle Reformer dédiée au 13 rue Duquesne. C'est l'intelligence de l'accessibilité : permettre aux adhérents (dont l'abonnement général est maintenu à 31,96 € par 4 semaines) d'allier la performance classique à la précision du mouvement contrôlé. Le studio promet un tarif concurrentiel pour ce supplément, reconnaissant la valeur du Pilates sans renier son accessibilité.\\n\\nEt pour finir, au début de l’année 2026, l’attente est également forte pour Club Pilates Brest à Kergaradec (9 rue Émile Bertin). Fort d'un réseau international, ce futur studio premium promet une expérience de remise en forme complète, mais accessible à tous, grâce à des horaires étendus (8h à 20h en semaine, et le samedi matin).\\nC'est l'opportunité à saisir : le studio cherche à récompenser ses premiers adeptes. Les cinquante premiers membres bénéficieront d'une réduction de 20 % sur leur adhésion à vie, transformant une simple inscription en un investissement durable dans le bien-être. Le compte à rebours est lancé pour l'arrivée de ce studio 100% Reformer.\",\"layout\":\"right_third\",\"heading\":\"Brest ne s’arrête pas là...\"}},{\"id\":\"1764350719698ff20n\",\"type\":\"text\",\"content\":{\"text\":\"L'hiver 2025-2026 ne signera pas qu'une simple diversification ; il marque la maturité de l'offre bien-être Brestoise. Que votre mode de vie penche vers le côté lifestyle de The New Me, l'approche holistique du Pura Vida Club, ou l'expertise de Physic Form et Club Pilates, chaque Brestois peut désormais choisir son chemin vers la maîtrise du corps.\\nPromesse tenue : je m'engage à tester personnellement chacun de ces \\\"théâtres du mouvement\\\" pour vous guider au mieux. Messieurs, cette pratique, bien que très clichée, est un défi de taille qui vous surprendra. Restez connectés pour les capsules et les retours détaillés.\\n\",\"layout\":\"two_thirds\"}}],\"references\":[],\"settings\":{\"headerEnabled\":true,\"headerText\":\"À la Brestoise\",\"footerEnabled\":true,\"footerText\":\" À bientôt !\",\"publishedAt\":\"2025-11-28\",\"readingTimeMode\":\"auto\",\"readingTimeMinutes\":5,\"featured\":true,\"date\":\"2025-11-28\",\"readingMinutes\":null,\"category\":\"Commerces & lieux\"}} -->\n\n# La vague du Pilates Reformer \n*Brest se met à la page !*\n\n\n## Cette méthode s'invite à Brest\n\nLoin de l'agitation des quais et du vent du large, une nouvelle élégance du mouvement s'est installée à Brest. Il ne s'agit pas d'une mode passagère, mais de l'avènement d'une discipline héritée de Joseph Pilates : la \"Contrology\". Une méthode qui, au-delà de la force, cherche l'union parfaite du corps et de l'esprit par la maîtrise du geste.\nEt en cette fin d'année 2025, cette quête de la précision prend une dimension inédite. Le Reformer, cette machine sophistiquée de bois et d'acier qui utilise ressorts et résistance, est la nouvelle star du bien-être Brestois. Son arrivée massive, symbolisée par l'ouverture de plusieurs adresses en quelques semaines, prouve que notre ville s'aligne désormais sur les tendances mondiales pour offrir un espace exigeant au mieux-être.\n\n\n## The New Me : La Révolution Lifestyle\n\nDès le 21 novembre, The New Me s’est imposé au 34 rue Monge comme l’adresse qui ancre définitivement le Reformer dans l’air du temps. Déjà présent dans plusieurs villes, le studio débarque ici avec un concept abouti et parfaitement maîtrisé.\nCe n’est pas seulement un espace d’entraînement : c’est un lieu de vie inspirant, pensé pour une sérénité active. Le bleu marine, clin d’œil élégant à la ville maritime ( Et oui, The New Me : c’est à chaque ville sa couleur ) se mêle à une ambiance de café healthy, créant un univers esthétique, moderne et Instagram-friendly.\n\nLe bar à latté est l’un des piliers du concept. Accessible à tous, que vous veniez pour un cours ou simplement pour le plaisir, il propose pour 5 € chacun des lattés dont l’incontournables matcha signature, accompagnés de snacks gluten-free signés @CopainsParis. Le spot rêvé pour les Clean Girls, les Matcha Lovers et toutes celles qui aiment prolonger une routine bien-être avec style.\nLe shop, lui aussi pensé comme une extension naturelle du studio, met en avant des marques françaises tendances et engagées, renforçant ce positionnement lifestyle où sport, esthétique et conscience se rejoignent.\nCôté pratique, l’expérience Reformer est millimétrée : 14 places maximum par cours, pour un encadrement précis et une progression de qualité. La fluidité est au centre des usages, avec une application dédiée qui simplifie paiements et réservations pour une expérience sans friction.\nEt parce que The New Me soigne chaque détail, l’expérience se poursuit jusque dans les vestiaires. Douches élégantes, cosmétiques à disposition, petite routine skincare possible avant de repartir : on ressort du studio comme d’un cocon, réénergisée, impeccable et prête à reprendre sa journée. Tout est pensé, tout est beau, tout est dans la tendance bref, un lieu qui coche toutes les cases du bien-être moderne.\n\n## Pura Vida Club : L'Holistique en Profondeur\n\nLe Pura Vida Club, qui ouvrira ses portes le 8 décembre 2025, apporte à la rue Keravel une vision du bien-être rare, presque contemplative. Ici, le Reformer ne se vit pas comme une simple discipline sportive, mais comme une pièce d’un écosystème complet dédié à la régénération du corps et de l’esprit. Dès l'entrée, le murmure d'une cascade, la lumière enveloppante et une ambiance slow living installent immédiatement un sentiment de calme profond.\nL’expérience repose sur une philosophie claire : créer un lieu où l’énergie du mouvement rencontre la douceur du ressourcement. Le studio abrite un espace bien-être complet comprenant un sauna infrarouge, un bain cryo, et des fauteuils massants pour accompagner le travail musculaire par un véritable rééquilibrage intérieur : Chaleur et froid, revitalisation et apaisement, performance et introspection : la dualité se vit ici comme un rituel qui harmonise le corps et l’esprit.\nLa décoration, zen et enveloppante, invite presque à la méditation. Chaque détail est pensé pour que la transition entre l’effort et la détente soit naturelle, fluide. On ne vient pas seulement pour un cours : on vient pour une pause totale, un moment où tout se recentre.\nPour s’adapter aux différents rythmes de vie, le Pura Vida Club propose quatre abonnements, à partir de 95 € par mois. Le plus complet donne accès à l’ensemble des espaces bien-être, offrant une expérience holistique du Reformer jusqu’à la récupération.\n En effet, le Pura Vida Club se distingue par son ampleur : un véritable espace pluridisciplinaire où le Reformer n’est qu’une facette d’un ensemble plus vaste, mêlant différentes pratiques sportives et rituels de bien-être, ce qui en fait un lieu original et profondément complet.\n\nEt pour accompagner l’ouverture, le studio propose une offre exclusive. Du 1er au 6 décembre, il est possible de prendre rendez-vous pour visiter les lieux, découvrir le concept en avant-première et finaliser son inscription. Pour tout engagement annuel, le Pura Vida Club offre un mois gratuit, une manière élégante de franchir le seuil du club et d’entrer pleinement dans sa philosophie.\nIci, le sport n’est pas qu’un entraînement. C’est un retour à soi, un espace où l’on se ressource entièrement  et c’est précisément ce qui fait du Pura Vida Club une adresse à part.\n\n## Brest ne s’arrête pas là...\n\nL’emblématique Physic Form ne reste pas en marge. Cette institution du fitness brestois annonce l'intégration prochaine d'une salle Reformer dédiée au 13 rue Duquesne. C'est l'intelligence de l'accessibilité : permettre aux adhérents (dont l'abonnement général est maintenu à 31,96 € par 4 semaines) d'allier la performance classique à la précision du mouvement contrôlé. Le studio promet un tarif concurrentiel pour ce supplément, reconnaissant la valeur du Pilates sans renier son accessibilité.\n\nEt pour finir, au début de l’année 2026, l’attente est également forte pour Club Pilates Brest à Kergaradec (9 rue Émile Bertin). Fort d'un réseau international, ce futur studio premium promet une expérience de remise en forme complète, mais accessible à tous, grâce à des horaires étendus (8h à 20h en semaine, et le samedi matin).\nC'est l'opportunité à saisir : le studio cherche à récompenser ses premiers adeptes. Les cinquante premiers membres bénéficieront d'une réduction de 20 % sur leur adhésion à vie, transformant une simple inscription en un investissement durable dans le bien-être. Le compte à rebours est lancé pour l'arrivée de ce studio 100% Reformer.\n\nL'hiver 2025-2026 ne signera pas qu'une simple diversification ; il marque la maturité de l'offre bien-être Brestoise. Que votre mode de vie penche vers le côté lifestyle de The New Me, l'approche holistique du Pura Vida Club, ou l'expertise de Physic Form et Club Pilates, chaque Brestois peut désormais choisir son chemin vers la maîtrise du corps.\nPromesse tenue : je m'engage à tester personnellement chacun de ces \"théâtres du mouvement\" pour vous guider au mieux. Messieurs, cette pratique, bien que très clichée, est un défi de taille qui vous surprendra. Restez connectés pour les capsules et les retours détaillés.\n",
  "author": "À la Brestoise",
  "date": "2025-11-28",
  "readingMinutes": 11,
  "featured": true,
  "excerpt": "Brest se met à la page !",
  "sources": []
}